"EmployerName","Address","CompanyNumber","SicCodes","DiffMeanHourlyPercent","DiffMedianHourlyPercent","DiffMeanBonusPercent","DiffMedianBonusPercent","MaleBonusPercent","FemaleBonusPercent","MaleLowerQuartile","FemaleLowerQuartile","MaleLowerMiddleQuartile","FemaleLowerMiddleQuartile","MaleUpperMiddleQuartile","FemaleUpperMiddleQuartile","MaleTopQuartile","FemaleTopQuartile","CompanyLinkToGPGInfo","ResponsiblePerson","EmployerSize","CurrentName","SubmittedAfterTheDeadline","DueDate","DateSubmitted"
"RITTER-COURIVAUD LIMITED","Equity House, Irthlingborough Road, Wellingborough, Northamptonshire, NN8 1LT","00363411","46380","	-1.9","	-13.3","53.9","0.0","85.8","89.2","87.0","13.0","98.1","1.9","75.9","24.1","74.1","25.9","http://www.tescoplc.com/genderpay","Charles Wilson (Chief Executive-Booker)","250 to 499","RITTER-COURIVAUD LIMITED","False","06/10/2021 00:00:00","24/02/2021 11:49:22"
"RIVUS FLEET SOLUTIONS LIMITED","Aquarius Building 4520 Solihull Parkway, Birmingham Business Park, Birmingham, England, B37 7YN","04383521","45200","	-2.0","10.0","	-211.0","	-137.0","65.0","3.0","67.0","33.0","90.0","10.0","88.0","12.0","82.0","18.0","https://rivusfleetsolutions.com/wp-content/uploads/2021/02/Gender-Pay-Gap-Report.pdf","Victoria Knight (HR Director)","500 to 999","RIVUS FLEET SOLUTIONS LIMITED","False","06/10/2021 00:00:00","23/02/2021 12:27:06"
"ROCKROSE UKCS 9 LIMITED","5th Floor Halton House, 20-23 Holborn, London, England, EC1N 2JD","01293052","82990","20.50","13.30","22.30","	-15.50","94.70","98.30","55.90","44.10","91.30","8.70","85.30","14.70","84.10","15.90","https://rockroseenergy.com/corporate-responsibility/","Caroline Galbraith (HR Manager)","250 to 499","ROCKROSE UKCS 9 LIMITED","False","06/10/2021 00:00:00","29/07/2020 16:00:43"
"ROLLS-ROYCE PLC","Kings Place, 90 York Way, London, United Kingdom, N1 9FX","01003142","25300,
25620,
28110","0.1","2.8","	-4.8","1.3","98.4","98.1","78","22","91","9","89","11","83","17","https://www.rolls-royce.com/sustainability/our-people.aspx#section-diversity-and-inclusion","Warren East (CEO)","5000 to 19,999","ROLLS-ROYCE PLC","False","06/10/2021 00:00:00","04/03/2021 10:43:49"
"ROLLS-ROYCE SUBMARINES LIMITED","Atlantic House, Raynesway, Derby, Derbyshire, United Kingdom, DE21 7BE","00620485","25300,
72190","6.4","3.6","19.9","14.5","99.0","98.8","75.0","25.0","86.0","14.0","87.0","13.0","86.0","14.0","https://www.rolls-royce.com/sustainability/our-people.aspx#section-diversity-and-inclusion","Steven Dearden (President Submarines - Defence)","1000 to 4999","ROLLS-ROYCE SUBMARINES LIMITED","False","06/10/2021 00:00:00","04/03/2021 10:50:42"
"ROMO LIMITED","Romo Limited, Oddicroft Lane, Sutton-In-Ashfield, England, NG17 5FB","00385709","46410","9.0","	-8.0","29.0","8.0","87.0","89.0","25.0","75.0","74.0","26.0","36.0","64.0","38.0","62.0","https://www.romo.com/legal","Felicity Mould (Creative Marketing Director)","250 to 499","ROMO LIMITED","False","06/10/2021 00:00:00","04/02/2021 13:54:41"
"ROSGAL LIMITED","Progress House, 396 Wilmslow Road, Manchester, M20 3BN","03731189","43999","	-6.8","	-35.6","0.0","0.0","33.3","25.0","60.0","40.0","100.0","0.0","20.0","80.0","60.0","40.0","","Garry O'Neill (Managing Director)","Less than 250","ROSGAL LIMITED","False","06/10/2021 00:00:00","12/02/2021 16:42:38"
"ROSS CERAMICS LIMITED","Moor Lane, Derby, Derbyshire, DE24 8BJ","02220030","23490","12.9","7.1","19.9","6.8","99.4","100.0","24.0","76.0","56.0","44.0","64.0","36.0","74.0","26.0","https://www.rolls-royce.com/sustainability/our-people.aspx#section-diversity-and-inclusion","Daniel Parrott (Manufacturing Executive)","250 to 499","ROSS CERAMICS LIMITED","False","06/10/2021 00:00:00","04/03/2021 10:47:35"
"ROWAN DARTINGTON & CO. LIMITED","St. James's Place House, 1 Tetbury Road, Cirencester, Gloucestershire, England, GL7 1FP","02752304","64999","43.2","47.9","79.9","50.8","87.5","92.7","44.3","55.7","39.1","60.9","58.6","41.4","85.9","14.1","https://www.rowan-dartington.co.uk/","David Money (Head of HR)","250 to 499","ROWAN DARTINGTON & CO. LIMITED","False","06/10/2021 00:00:00","27/01/2021 10:36:55"
"ROYAL AGRICULTURAL UNIVERSITY","Royal Agricultural University, Stroud Road, Cirencester, Gloucestershire, GL7 6JS","00099168","85421,
85422","14.6","13.7","","","0.0","0.0","45.0","55.0","29.5","70.5","35.0","65.0","58.0","42.0","https://www.rau.ac.uk/about/organisation/public-information/equality-and-diversity","Sarah Lower (Director of Human Resources)","250 to 499","ROYAL AGRICULTURAL UNIVERSITY","False","06/10/2021 00:00:00","10/03/2021 10:51:20"
"Royal Berkshire Nhs Foundation Trust","London Road, Reading, Berkshire, United Kingdom, RG1 5AN","","1,
86210","24.1","7.4","29.5","33.3","7.0","0.8","22.6","77.4","19.5","80.5","14.8","85.2","34.3","65.7","","","5000 to 19,999","Royal Berkshire Nhs Foundation Trust","False","06/10/2021 00:00:00","05/03/2021 15:48:05"
"Royal College of Music","Prince Consort Road, London, SW7 2BS","","1,
85421","6.6","0.0","","","0.0","0.0","42.9","57.1","60.3","39.7","59.8","40.2","50.0","50.0","","","500 to 999","Royal College of Music","False","06/10/2021 00:00:00","09/03/2021 17:00:43"
"Royal College of Physicians","11 St Andrews Place, London, London, United Kingdom, NW1 4LE","","85200","11.8","16.7","","","0.0","0.0","23.0","77.0","30.0","70.0","32.0","68.0","40.0","60.0","","Ian Bullock (Chief Executive Officer)","250 to 499","Royal College of Physicians","False","06/10/2021 00:00:00","22/02/2021 15:09:50"
"ROYAL INSTITUTION OF CHARTERED SURVEYORS","12 Great George Street, Parliament Square, London, London, United Kingdom, SW1P 3AD","RC000487","","24.6","16.7","25.1","27.8","23.0","11.0","38.0","62.0","36.0","64.0","34.0","66.0","64.0","36.0","https://www.rics.org/globalassets/rics-website/media/about/di/rics0108---gender-pay-report-2020-spreads-web.pdf","Richard Higginson (Head of Reward)","500 to 999","ROYAL INSTITUTION OF CHARTERED SURVEYORS","False","06/10/2021 00:00:00","08/03/2021 17:26:19"
"ROYAL LONDON MUTUAL INSURANCE SOCIETY,LIMITED(THE)","55 Gracechurch Street, London, EC3V 0RL","00099064","66290","34.1","24.2","67.1","38.8","89.0","91.0","40.0","60.0","48.0","52.0","61.0","39.0","67.0","33.0","https://www.royallondon.com/careers/inclusion-and-diversity/","Barry O'Dwyer (Company CEO - Chief Executive Officer)","1000 to 4999","ROYAL LONDON MUTUAL INSURANCE SOCIETY,LIMITED(THE)","False","06/10/2021 00:00:00","04/03/2021 17:59:35"
"RPMI LIMITED","100 Liverpool Street, London, United Kingdom, EC2M 2AT","02315380","65300","42.0","28.8","65.2","29.9","81.9","83.6","37.0","63.0","46.0","54.0","52.0","48.0","70.0","30.0","https://www.rpmi.co.uk/about/gender-pay-reporting","John Chilman (Chief Executive)","250 to 499","RPMI LIMITED","False","06/10/2021 00:00:00","07/01/2021 13:47:24"
"Rushcliffe Borough Council","Ruchcliffe Arena, Rugby Road, West Bridgford, Nottingham, Nottinghamshire, United Kingdom, NG2 7YG","","1,
84110","1.0","	-1.0","	-36.0","	-58.0","3.5","3.4","51.0","49.0","60.0","40.0","60.0","40.0","48.0","52.0","","","250 to 499","Rushcliffe Borough Council","False","06/10/2021 00:00:00","05/10/2020 14:48:35"
"RUSSELL INVESTMENTS SYSTEMS LIMITED","10 Regent Street Rex House, London, United Kingdom, SW1Y 4PE","02415166","82990","18.4","16.6","46.2","18.7","100.0","100.0","51.0","49.0","54.0","46.0","64.0","36.0","79.0","21.0","","Joe Linhares (Head of EMEA)","Not Provided","RUSSELL INVESTMENTS SYSTEMS LIMITED","False","06/10/2021 00:00:00","21/12/2020 12:23:34"
"RUSSELL SCHOOL TRUST","Royal Russell School, Coombe Lane, Croydon Surrey, CR9 5BX","01163246","85100,
85200,
85310","13.0","11.0","","","0.0","0.0","38.0","62.0","30.0","70.0","20.0","80.0","54.0","46.0","","Chris Hutchinson (Headmaster)","250 to 499","RUSSELL SCHOOL TRUST","False","06/10/2021 00:00:00","24/02/2021 14:55:34"
"Rutland County Council","Catmose House, Catmose Street, Oakham, LE15 6HP","","1,
84110","9.4","	-6.0","","","0.0","0.0","29.0","71.0","23.0","77.0","21.0","79.0","26.0","74.0","","","250 to 499","Rutland County Council","False","06/10/2021 00:00:00","23/02/2021 13:43:09"
"RWG (REPAIR & OVERHAULS) LIMITED","15 Justice Mill Lane, Aberdeen, AB11 6EQ","SC120673","28110","6.3","8.0","	-6.5","	-90.9","97.2","96.3","83.0","17.0","88.0","12.0","89.0","11.0","90.0","10.0","https://rwgroup.com/wp-content/uploads/2021/03/Gender-Pay-Gap-Summary-2020.pdf","Mark Forsyth (Interim Managing Director)","250 to 499","RWG (REPAIR & OVERHAULS) LIMITED","False","06/10/2021 00:00:00","04/03/2021 08:14:28"
"RYGOR HOLDINGS LIMITED","The Broadway, West Wilts Trading Estate, Westbury, Wiltshire, BA13 4JX","06506121","82110","22.5","23.0","16.5","25.0","28.0","56.1","70.0","30.0","69.0","31.0","94.0","6.0","91.0","9.0","https://www.rygor.co.uk/","Graham Drake (Finance Director)","500 to 999","RYGOR HOLDINGS LIMITED","False","06/10/2021 00:00:00","21/08/2020 13:54:31"
"S.B.E. LTD.","5th Floor Ashford Commercial Quarter, 1 Dover Place, Ashford, Kent, England, TN23 1FB","03203217","33140","9.7","6.5","45.8","44.2","23.8","20.9","32","68","55","45","69","31","64","36","","Munish Rattu (CEO)","250 to 499","S.B.E. LTD.","False","06/10/2021 00:00:00","05/03/2021 15:59:35"
"S4E LIMITED","Unit 3 Holt Court Holt Street, Birmingham Science Park Aston, Birmingham, England, B7 4AX","07739831","85520,
85600,
90030","4.20","0.00","","","0.00","0.00","41.80","58.20","37.00","63.00","44.40","55.60","51.90","48.10","https://www.servicesforeducation.co.uk/wp-content/uploads/2020/05/2020-GPR-narrative.pdf","Sharon Bell (Chief Executive)","250 to 499","SERVICES FOR EDUCATION LIMITED","False","06/10/2021 00:00:00","19/05/2020 10:51:46"
"SAINSBURY'S BANK PLC","33 Holborn, London, EC1N 2HT","03279730","64191","36.6","23.6","65.3","65.6","54.3","39.4","22.5","77.5","29.3","70.7","34.0","66.0","56.7","43.3","https://www.about.sainsburys.co.uk/~/media/Files/S/Sainsburys/Gender%20Ethnicity%20Pay%20Gap%20Report%202020.pdf","Simon Roberts (Chief Executive Officer)","1000 to 4999","SAINSBURY'S BANK PLC","False","06/10/2021 00:00:00","10/12/2020 15:30:11"
"SAINSBURY'S SUPERMARKETS LTD","33 Holborn, London, EC1N 2HT","03261722","47110","9.6","5.0","56.9","30.4","57.1","66.5","32.1","67.9","36.2","63.8","52.9","47.1","60.1","39.9","https://www.about.sainsburys.co.uk/~/media/Files/S/Sainsburys/Gender%20Ethnicity%20Pay%20Gap%20Report%202020.pdf","Simon Roberts (Chief Executive Officer)","20,000 or more","SAINSBURY'S SUPERMARKETS LTD","False","06/10/2021 00:00:00","10/12/2020 15:32:51"
"Salford Royal Foundation Trust","Hope Hospital, Stott Lane, Salford, Greater Manchester, United Kingdom, M6 8HD","","1,
86210","24.5","10.9","44.6","1.3","6.4","0.5","19.5","80.5","17.3","82.7","17.1","82.9","32.8","67.2","","","5000 to 19,999","Salford Royal Foundation Trust","False","06/10/2021 00:00:00","11/03/2021 16:32:57"
"Salisbury Nhs Foundation Trust","Odstock Road, Salisbury, Wiltshire, SP2 8BJ","","1,
86210","22.1","6.7","31.5","46.7","5.7","1.3","19.7","80.3","20.5","79.5","16.3","83.7","30.6","69.4","http://www.salisbury.nhs.uk","","1000 to 4999","Salisbury Nhs Foundation Trust","False","06/10/2021 00:00:00","24/08/2020 12:34:38"
"SALMON LIMITED","Sea Containers, 18 Upper Ground, London, United Kingdom, SE1 9GL","02360867","73110","23.4","24.5","42.2","28.0","73.9","67.5","53.0","47.0","61.0","39.0","66.0","34.0","83.0","17.0","","Hannah Short (People Director)","250 to 499","SALMON LIMITED","False","06/10/2021 00:00:00","11/03/2021 09:19:24"
"SALVATION ARMY HOUSING ASSOCIATION","St Olaves House, 10 Lloyd's Avenue, London, Ec3n 3aj","IP15210R","","19.0","0.9","","","0.0","0.0","31.0","69.0","22.0","78.0","34.0","66.0","46.0","54.0","https://saha.org.uk/about/equality-diversity/","Nigel Hills (Chief Executive)","250 to 499","SALVATION ARMY HOUSING ASSOCIATION","False","06/10/2021 00:00:00","16/12/2020 12:40:09"
"SANTANDER CONSUMER (UK) PLC","Santander House, 86 Station Road, Redhill, Surrey, RH1 1SR","02248870","64910,
64921","31.1","28.0","48.6","38.9","88.4","86.3","35.4","64.6","45.3","54.7","53.1","46.9","67.3","32.7","https://www.santanderconsumer.co.uk/wp-content/uploads/Santander-Consumer-UK-Gender-Pay-Gap-Report-2020-.pdf","Diane Roberts (Finance Director)","500 to 999","SANTANDER CONSUMER (UK) PLC","False","06/10/2021 00:00:00","21/12/2020 10:05:19"
"SANTANDER UK OPERATIONS LIMITED","2 Triton Square, Regent's Place, London, NW1 3AN","04137550","64999","5.2","1.2","26.2","22.5","93.6","95.6","47.3","52.7","33.6","66.4","36.9","63.1","45.3","54.7","http://www.santanderjobs.co.uk/pdf/Santander_Operations_Gender_Pay_Gap_Report_2020.pdf","Iain Plunkett (Chief Operating Officer)","1000 to 4999","SANTANDER UK OPERATIONS LIMITED","False","06/10/2021 00:00:00","22/12/2020 21:26:29"
"SANTANDER UK PLC","2 Triton Square, Regent's Place, London, NW1 3AN","02294747","64191,
82990","30.7","27.0","63.1","45.5","90.6","92.7","35.3","64.7","28.4","71.6","41.8","58.2","60.3","39.7","http://www.santanderjobs.co.uk/pdf/Santander_UK_Gender_Pay_Gap_Report_2020.pdf","Nathan Bostock (CEO)","5000 to 19,999","SANTANDER UK PLC","False","06/10/2021 00:00:00","22/12/2020 21:32:04"
"SANTANDER UK TECHNOLOGY LIMITED","2 Triton Square, Regents Place, London, NW1 3AN","05212726","62020","10.0","9.5","8.6","5.9","84.2","91.3","67.3","32.7","72.8","27.2","79.9","20.1","84.8","15.2","http://www.santanderjobs.co.uk/pdf/Santander_UK_Technology_GPG_report_2020.pdf","Iain Plunkett (Chief Operating Officer)","1000 to 4999","SANTANDER UK TECHNOLOGY LIMITED","False","06/10/2021 00:00:00","22/12/2020 21:28:53"
"SAS SOFTWARE LIMITED","Wittington House Henley Road, Medmenham, Marlow, Buckinghamshire, England, SL7 2EB","01316437","62012,
62020","26.0","30.2","48.3","34.0","91.7","91.0","58.9","41.1","65.4","34.6","74.7","25.3","85.1","14.9","https://www.sas.com/content/dam/SAS/documents/legal-employee-services/legal/gender-pay-gap-report-2020.pdf","Belinda Macaulay (Director, Human Resources)","500 to 999","SAS SOFTWARE LIMITED","False","06/10/2021 00:00:00","17/02/2021 16:45:15"
"SCA WOOD UK LTD","Etruscan Street, Etruria, Stoke On Trent, Staffordshire, ST1 5PG","02541468","16100","	-4.8","	-16.5","32.4","12.2","84.7","83.3","90.7","9.3","90.6","9.4","90.7","9.3","83.0","17.0","","Lynsey Pace (HR Manager)","250 to 499","BSW TIMBER SOLUTIONS LTD","False","06/10/2021 00:00:00","23/02/2021 13:55:23"
"SCISYS UK LIMITED","Methuen Park, Chippenham, Wiltshire, SN14 0GB","04373530","62012,
62020,
62030,
62090","25.10","28.20","60.20","	-20.00","35.10","25.60","70.10","29.90","87.90","12.10","88.10","11.90","93.90","6.10","https://www.cgi-group.co.uk/sites/default/files/2020-07/scisys-uk-limited-gender-pay-gap-report-2020.pdf","Tara McGeehan (President, CGIs UK Operations)","250 to 499","SCISYS UK LIMITED","False","06/10/2021 00:00:00","30/07/2020 16:43:39"
"SCOTSDALE NURSERY AND GARDEN CENTRE LIMITED","Scotsdale Nusery & Garden Centre Ltd Cambridge Road, Great Shelford, Cambridge, Cambridgeshire, CB22 5JT","00820387","47599,
47760","2.6","2.0","","","0.0","0.0","42.0","58.0","26.0","74.0","58.0","42.0","52.0","48.0","","Ben Rayner (Finance Director)","Less than 250","SCOTSDALE NURSERY AND GARDEN CENTRE LIMITED","False","06/10/2021 00:00:00","30/11/2020 16:13:48"
"SCOTTISH AND SOUTHERN ENERGY POWER DISTRIBUTION LIMITED","Inveralmond House, 200 Dunkeld Road, Perth, PH1 3AQ","SC213459","35130","1.00","17.60","72.10","11.20","6.40","15.80","91.90","8.10","99.30","0.70","98.50","1.50","96.30","3.70","https://www.sse.com/media/eh0dqrrw/sse-sustainability-report-2020.pdf","Alistair Phillips-Davies (CEO)","500 to 999","SCOTTISH AND SOUTHERN ENERGY POWER DISTRIBUTION LIMITED","False","06/10/2021 00:00:00","30/07/2020 16:46:10"
"SCOTTISH ASSOCIATION FOR MENTAL HEALTH","Brunswick House, 51 Wilson Street, Glasgow, G1 1UZ","SC082340","87200,
87900,
88990","3.6","	-2.1","","","0.0","0.0","31.1","68.9","26.0","74.0","25.2","74.8","28.2","71.8","https://www.samh.org.uk/about-us","William Watson (Chief Executive)","500 to 999","SCOTTISH ASSOCIATION FOR MENTAL HEALTH","False","06/10/2021 00:00:00","11/03/2021 10:41:59"
"SCOTTISH HYDRO ELECTRIC POWER DISTRIBUTION PLC","Inveralmond House, 200 Dunkeld Road, Perth, PH1 3AQ","SC213460","35130","15.50","16.40","56.00","23.60","17.10","12.60","60.70","39.30","79.60","20.40","83.00","17.00","85.90","14.10","https://www.sse.com/media/eh0dqrrw/sse-sustainability-report-2020.pdf","Alistair Phillips-Davies (CEO)","1000 to 4999","SCOTTISH HYDRO ELECTRIC POWER DISTRIBUTION PLC","False","06/10/2021 00:00:00","30/07/2020 16:48:47"
"SCOTTISH HYDRO ELECTRIC TRANSMISSION PLC","Inveralmond House, 200 Dunkeld Road, Perth, PH1 3AQ","SC213461","35120","23.20","29.80","64.30","34.40","38.40","40.00","52.90","47.10","82.40","17.60","88.20","11.80","93.10","6.90","https://www.sse.com/media/eh0dqrrw/sse-sustainability-report-2020.pdf","Alistair Phillips-Davies (CEO)","250 to 499","SCOTTISH HYDRO ELECTRIC TRANSMISSION PLC","False","06/10/2021 00:00:00","30/07/2020 16:52:01"
"SCOTTISH POWER UK PLC","320 St. Vincent Street, Glasgow, Scotland, G2 5AD","SC117120","70100","27.8","22.1","46.3","21","59.2","46.6","31","69","38","62","56","44","59","41","https://www.scottishpower.com/pages/gender_pay.aspx","Keith Anderson (CEO ScottishPower)","500 to 999","SCOTTISH POWER UK PLC","False","06/10/2021 00:00:00","09/03/2021 09:58:37"
"SCOTTISH WIDOWS SERVICES LIMITED","69 Morrison Street, Edinburgh, EH3 8YF","SC189975","66290","17.4","15","45.5","58.1","99.5","99.7","44","56","44.8","55.2","55.8","44.2","64","36","https://www.lloydsbankinggroup.com/assets/pdfs/who-we-are/responsible-business/downloads/lbg-gender-pay-gap-report-2019-20.pdf","Matt Sinnott (Group People & Productivity Director)","1000 to 4999","SCOTTISH WIDOWS SERVICES LIMITED","False","06/10/2021 00:00:00","11/12/2020 11:51:32"
"SCOTTISHPOWER ENERGY RETAIL LIMITED","320 St. Vincent Street, Glasgow, Scotland, G2 5AD","SC190287","35120,
35220","20","19.5","54.9","57.8","50.4","58.2","22","78","41","59","50","50","59","41","https://www.scottishpower.com/pages/gender_pay.aspx","Keith Anderson (CEO ScottishPower)","1000 to 4999","SCOTTISHPOWER ENERGY RETAIL LIMITED","False","06/10/2021 00:00:00","09/03/2021 09:56:09"
"SCOTTISHPOWER RENEWABLES (UK) LIMITED","The Soloist, 1 Lanyon Place, Belfast, Northern Ireland, BT1 3LP","NI028425","35110","3.4","8.1","12.6","17.6","65.8","75.2","76","24","69","31","75","25","76","24","https://www.scottishpower.com/pages/gender_pay.aspx","Keith Anderson (CEO ScottishPower)","250 to 499","SCOTTISHPOWER RENEWABLES (UK) LIMITED","False","06/10/2021 00:00:00","09/03/2021 09:59:06"
"SCREWFIX DIRECT LIMITED","Trade House Mead Avenue, Houndstone Business Park, Yeovil, Somerset, BA22 8RT","03006378","46130,
47520,
47910","6.1","0.7","46.8","53.8","20.0","18.2","58.2","41.8","58.8","41.2","59.3","40.7","68.0","32.0","https://www.screwfix.com/gender-pay-report","Bernard Bot (Chief Financial Officer)","5000 to 19,999","SCREWFIX DIRECT LIMITED","False","06/10/2021 00:00:00","26/02/2021 12:06:25"
"SDBE MULTI-ACADEMY TRUST","48 Union Street, London, United Kingdom, SE1 1TD","10385920","85200,
85310","22.8","32.8","","","0.0","0.0","2.6","97.4","8.7","91.3","25.2","74.8","21.6","78.4","","Thomas Scrace (HR Business Partner)","250 to 499","SDBE MULTI-ACADEMY TRUST","False","06/10/2021 00:00:00","11/11/2020 10:36:18"
"SEETEC BUSINESS TECHNOLOGY CENTRE LIMITED","75/77 Main Road, Hockley, Essex, SS5 4RG","02291188","85320","28.9","35.8","54.5","	-50.9","1.5","0.2","20.0","80.0","46.3","53.7","59.3","40.7","65.5","34.5","https://www.seetec.co.uk/files/a2f29-Seetec%20Group%20Gender%20Pay%20Report%202020.pdf","John Baumback (Group Chief Executive Officer)","Less than 250","SEETEC BUSINESS TECHNOLOGY CENTRE LIMITED","False","06/10/2021 00:00:00","12/03/2021 09:11:48"
"Selby College","Abbots Road, Selby, YO8 8AT","","1,
85310","16.0","22.0","","","0.0","0.0","20.0","80.0","29.0","71.0","45.0","55.0","54.5","45.5","","","Less than 250","Selby College","False","06/10/2021 00:00:00","18/02/2021 13:33:29"
"SERCO LEISURE OPERATING LIMITED","Serco House, 16 Bartley Wood Business Park, Bartley Way, Hook, Hampshire, RG27 9UZ","04687478","93110","3.3","7.7","15.0","46.5","5.3","11.3","44.4","55.6","24.1","75.9","73.5","26.5","68.2","31.8","https://www.serco.com/about/corporate-responsibility/gender-pay-gap-report","Anthony Kirby (Chief Operating Officer)","Less than 250","SERCO LEISURE OPERATING LIMITED","False","06/10/2021 00:00:00","08/02/2021 11:10:14"
"SERCO LIMITED","Serco House, 16 Bartley Wood Business Park, Bartley Way Hook, Hampshire, RG27 9UY","00242246","70100,
70229,
72190,
84110","13.7","10.3","15.5","	-38.0","8.7","4.4","49.1","50.9","52.0","48.0","64.7","35.3","64.6","35.4","https://www.serco.com/about/corporate-responsibility/gender-pay-gap-report","Anthony Kirby (Chief Operating Officer)","5000 to 19,999","SERCO LIMITED","False","06/10/2021 00:00:00","08/02/2021 11:04:58"
"Serious Fraud Office","2-4 Cockspur Street, London, London, United Kingdom, SW1Y 5BS","","1,
84110","4.9","4.2","2.8","0.0","79.2","78.0","42.7","57.3","57.3","42.7","56.4","43.6","59.8","40.2","","","250 to 499","Serious Fraud Office","False","06/10/2021 00:00:00","19/01/2021 17:50:59"
"SERVICENOW UK LIMITED","1 Bridge Street, Staines-Upon-Thames, England, TW18 4TP","06299383","62090","14.3","22.3","44.3","42.6","89.1","83.0","64.9","35.1","72.5","27.5","79.5","20.5","83.0","17.0","https://www.servicenow.com/company/diversity-inclusion-belonging.html","Sally Sourbron (Senior Director, HR | EMEA)","500 to 999","SERVICENOW UK LIMITED","False","06/10/2021 00:00:00","21/08/2020 08:53:51"
"SETTLE GROUP","Blackhorse Road, Letchworth Garden City, Hertfordshire, United Kingdom, SG6 1HA","IP30003R","","11.0","9.0","5.0","0.0","84.0","72.0","27.0","73.0","40.0","60.0","43.0","57.0","49.0","51.0","https://www.settlegroup.org.uk/equality-and-diversity","Donna North (Head of People and Engagement)","250 to 499","SETTLE GROUP","False","06/10/2021 00:00:00","02/03/2021 08:20:04"
"SEVERN TRENT WATER LIMITED","Severn Trent Centre, 2 St John's Street, Coventry, CV1 2LZ","02366686","36000","2.3","9.3","	-57.1","0.0","91.4","91.2","55.4","44.6","78.7","21.3","80.4","19.6","71.7","28.3","https://www.severntrent.com/sustainability-strategy/reports-and-publications/gender-pay-gap/","Olivia Garfield (Chief Executive Officer)","5000 to 19,999","SEVERN TRENT WATER LIMITED","False","06/10/2021 00:00:00","26/11/2020 11:25:16"
"SHAWBROOK BANK LIMITED","Lutea House The Drive, Warley Hill Business Park, Great Warley, Brentwood, Essex, CM13 3BE","00388466","64191","38.6","43.1","56.9","46.9","87.0","89.2","35.9","64.1","42.7","57.3","68.4","31.6","83.5","16.5","https://www.shawbrook.co.uk/media/3527/gender-pay-gap-report-2020-final-01122020.pdf","Ian Cowie (CEO)","500 to 999","SHAWBROOK BANK LIMITED","False","06/10/2021 00:00:00","02/12/2020 17:10:42"
"Sheffield Hallam University","City Campus, Howard Street, Sheffield, South Yorkshire, United Kingdom, S1 1WB","","1,
85421","9.8","13.7","28.9","4.4","0.9","0.9","33.1","66.9","39.4","60.6","46","54","49.2","50.8","https://www.shu.ac.uk/about-us/equality-and-diversity","","1000 to 4999","Sheffield Hallam University","False","06/10/2021 00:00:00","08/12/2020 16:10:50"
"SHELL ENERGY RETAIL LIMITED","Shell Energy House Westwood Business Park, Westwood Way, Coventry, England, CV4 8HS","05070887","35140","17.1","12.5","26.5","25.0","30.5","20.6","53.7","46.3","55.2","44.8","54.8","45.2","71.4","28.6","https://www.shell.co.uk/diversitypay","Sinead Lynch (UK Country Chair)","1000 to 4999","SHELL ENERGY RETAIL LIMITED","False","06/10/2021 00:00:00","25/11/2020 09:40:48"
"SHELL INFORMATION TECHNOLOGY INTERNATIONAL LIMITED","Shell Centre, London, England, SE1 7NA","00165727","62090","10.1","14.0","13.0","33.1","93.2","91.3","57.1","42.9","67.0","33.0","78.3","21.7","71.7","28.3","https://www.shell.co.uk/diversitypay","Sinead Lynch (UK Country Chair)","250 to 499","SHELL INFORMATION TECHNOLOGY INTERNATIONAL LIMITED","False","06/10/2021 00:00:00","25/11/2020 09:37:36"
"SHELL INTERNATIONAL LIMITED","Shell Centre, London, SE1 7NA","03075807","82990","24.5","21.4","33.4","62.8","97.2","97.6","34.0","66.0","48.3","51.7","57.3","42.7","71.0","29.0","https://www.shell.co.uk/diversitypay","Sinead Lynch (UK Country Chair)","500 to 999","SHELL INTERNATIONAL LIMITED","False","06/10/2021 00:00:00","25/11/2020 09:35:29"
"SHELL INTERNATIONAL PETROLEUM COMPANY LIMITED","Shell Centre, London, SE1 7NA","00621148","82990","21.5","17.4","43.6","51.0","96.9","96.0","48.5","51.5","58.6","41.4","70.5","29.5","76.7","23.3","https://www.shell.co.uk/diversitypay","Sinead Lynch (UK Country Chair)","1000 to 4999","SHELL INTERNATIONAL PETROLEUM COMPANY LIMITED","False","06/10/2021 00:00:00","25/11/2020 09:32:32"
"SHELL INTERNATIONAL TRADING AND SHIPPING COMPANY LIMITED","Shell Centre, London, England, SE1 7NA","00525037","46711,
50200,
66120","19.0","17.6","64.0","52.9","95.0","97.1","49.8","50.2","67.3","32.7","73.0","27.0","72.6","27.4","https://www.shell.co.uk/diversitypay","Sinead Lynch (UK Country Chair)","500 to 999","SHELL INTERNATIONAL TRADING AND SHIPPING COMPANY LIMITED","False","06/10/2021 00:00:00","25/11/2020 09:30:29"
"SHELL U.K. LIMITED","Shell Centre, London, SE1 7NA","00140141","6100","12.3","16.7","	-10.9","3.9","96.3","96.6","65.2","34.8","86.1","13.9","86.4","13.6","85.3","14.7","https://www.shell.co.uk/diversitypay","Sinead Lynch (UK Country Chair)","1000 to 4999","SHELL U.K. LIMITED","False","06/10/2021 00:00:00","25/11/2020 09:27:25"
"SHELL U.K. OIL PRODUCTS LIMITED","Shell Centre, London, SE1 7NA","03625633","46719","7.8","5.8","8.6","	-11.3","98.1","96.9","58.7","41.3","57.1","42.9","65.6","34.4","65.6","34.4","https://www.shell.co.uk/diversitypay","Sinead Lynch (UK Country Chair)","250 to 499","SHELL U.K. OIL PRODUCTS LIMITED","False","06/10/2021 00:00:00","25/11/2020 09:25:32"
