"EmployerName","Address","CompanyNumber","SicCodes","DiffMeanHourlyPercent","DiffMedianHourlyPercent","DiffMeanBonusPercent","DiffMedianBonusPercent","MaleBonusPercent","FemaleBonusPercent","MaleLowerQuartile","FemaleLowerQuartile","MaleLowerMiddleQuartile","FemaleLowerMiddleQuartile","MaleUpperMiddleQuartile","FemaleUpperMiddleQuartile","MaleTopQuartile","FemaleTopQuartile","CompanyLinkToGPGInfo","ResponsiblePerson","EmployerSize","CurrentName","SubmittedAfterTheDeadline","DueDate","DateSubmitted"
"KLM UK ENGINEERING LIMITED","Liberator Road, Norwich Airport, Norwich, Norfolk, NR6 6ER","02513110","52230","36.0","37.9","39.8","25.8","97.3","93.9","72.5","27.5","91.2","8.8","97.1","2.9","96.1","3.9","","Peter van der Horst (Managing Director)","250 to 499","KLM UK ENGINEERING LIMITED","False","06/10/2021 00:00:00","04/03/2021 15:43:29"
"KNIGHTON FOODS LIMITED","Premier House Centrium Business Park, Griffiths Way, St Albans, Hertfordshire, United Kingdom, AL1 2RE","08954731","10890","10.0","0.0","	-30.0","	-5.0","14.0","8.0","62.0","38.0","80.0","20.0","71.0","29.0","83.0","17.0","https://www.premierfoods.co.uk/CorporateSite/media/documents/responsibility/gender_pay/Premier-Foods-Gender-Pay-Gap-Report-2020.pdf","David Wilkinson (HR & Communications Director)","1000 to 4999","KNIGHTON FOODS LIMITED","False","06/10/2021 00:00:00","10/02/2021 10:42:31"
"KOBER LIMITED","IPL, Unit 1 Foxbridge Way, Normanton Industrial Estate, Normanton, West Yorkshire, England, WF6 1TN","07443319","10130","11.3","0","5.3","0","91.6","95.4","50","50","50","50","51.8","48.2","70.5","29.5","","Michelle Hand (People Director IPL)","500 to 999","KOBER LIMITED","False","06/10/2021 00:00:00","28/01/2021 12:57:57"
"KONECRANES DEMAG UK LIMITED","Unit 1 Charter Point, Coalfield Way,, Ashby Business Park, Ashby De La Zouch, Leicestershire, England, LE65 1NF","00969869","28220,
33200","17.3","20.6","46.5","	-14.6","61.3","85.0","69.7","30.3","87.6","12.4","89.3","10.7","87.6","12.4","https://www.konecranes.com/en-uk/about/","Karen Winfield (HR Director  UK/EMEA- Mid West Konecranes Demag UK Ltd)","250 to 499","KONECRANES DEMAG UK LIMITED","False","06/10/2021 00:00:00","22/01/2021 09:21:30"
"L.E.A.D. ACADEMY TRUST","The Old Pumphouse, 5 The Ropewalk, Nottingham, NG1 5DU","08296921","85200,
85310","22.4","32.2","","","0.0","0.0","15.0","85.0","16.0","84.0","15.0","85.0","15.0","85.0","","","1000 to 4999","L.E.A.D. ACADEMY TRUST","False","06/10/2021 00:00:00","24/02/2021 14:26:45"
"LALEHAM HEALTH AND BEAUTY LIMITED","Sycamore Park, Mill Lane, Alton, Hampshire, GU34 2PR","00997221","32990","11","8","40","6","81","80","44","56","56","44","60","40","62","38","https://www.laleham.com/responsibility/gender-pay-gap-reporting","Tim O'Connor (Managing Director)","500 to 999","LALEHAM HEALTH AND BEAUTY LIMITED","False","06/10/2021 00:00:00","03/03/2021 15:10:05"
"Lancashire Care Nhs Foundation Trust","Sceptre Point, Sceptre Way, Preston, PR5 6AW","","1,
86210","12.0","3.2","19.0","20.0","1.8","0.3","18.8","81.2","21.8","78.2","18.0","82.0","25.6","74.4","https://www.lscft.nhs.uk/ED","","5000 to 19,999","Lancashire Care Nhs Foundation Trust","False","06/10/2021 00:00:00","05/02/2021 12:33:57"
"Lancaster & Morecambe College","Morecambe Road, Lancaster, Lancashire, United Kingdom, LA1 2TY","","1,
85320","10.0","13.8","","","0.0","0.0","31.0","69.0","21.0","79.0","39.0","61.0","41.0","59.0","https://www.lmc.ac.uk/about/college-policies/gender-pay-gap-report-2020","","250 to 499","Lancaster & Morecambe College","False","06/10/2021 00:00:00","04/12/2020 13:09:21"
"LAND SECURITIES PROPERTIES LIMITED","100 Victoria Street, London, United Kingdom, SW1E 5JL","00961477","68320","37.70","34.30","61.00","48.40","82.90","78.70","30.10","69.90","36.10","63.90","58.30","41.70","71.20","28.80","https://landsec.com/aboutcorporate-governance/gender-pay","Barry Hoffman (Group HR Director)","500 to 999","LAND SECURITIES PROPERTIES LIMITED","False","06/10/2021 00:00:00","10/07/2020 11:15:59"
"LANGLEY HOUSE TRUST","3 & 4 The Square, Manfield Avenue,, Walsgrave,, Coventry, England, CV2 2QJ, 6364","07888191","87900","2.7","0.0","","","0.0","1.8","34.3","65.7","41.7","58.3","30.0","70.0","44.4","55.6","https://www.langleyhousetrust.org/about-us/publications/","Tracy Wild (Chief Executive Officer)","250 to 499","LANGLEY HOUSE TRUST","False","06/10/2021 00:00:00","08/03/2021 15:05:34"
"LE CREUSET U.K. LIMITED","Le Creuset House, 83 Livingstone Road, Walworth Industrial Estate,, Andover, Hampshire, SP10 5QZ","00457936","46499,
47789","27.5","4.9","74.1","21.0","39.1","46.9","26.2","73.8","33.3","66.7","33.3","66.7","37.9","62.1","","Cary Ann Evans (HR Manager)","250 to 499","LE CREUSET U.K. LIMITED","False","06/10/2021 00:00:00","13/03/2021 12:04:30"
"Leeds Arts University","Blenheim Walk, Leeds, LS2 9BP","","1,
85421","4.0","5.7","","","0.0","0.0","38.2","61.8","34.6","65.4","42.3","57.7","43.6","56.4","https://www.leeds-art.ac.uk/about-us/governance/gender-pay-gap-reporting-2020/","","250 to 499","Leeds Arts University","False","06/10/2021 00:00:00","10/02/2021 14:08:35"
"Leeds Building Society","105 Albion Street, LS1 5AS","","","35.0","30.8","49.5","32.6","74.2","78.1","26.9","73.1","28.4","71.6","44.6","55.4","61.5","38.5","https://www.leedsbuildingsociety.co.uk/_resources/pdfs/your-society-pdfs/gpg-2020.pdf","Andrew Greenwood (Chief Risk Officer)","1000 to 4999","Leeds Building Society","False","06/10/2021 00:00:00","03/03/2021 10:27:01"
"Leeds City Council","Leeds Civic Hall, Calverley Street, Leeds, LS1 1UR","","1,
84110","6.0","10.4","39.6","44.0","3.5","0.0","25.4","74.6","40.8","59.2","49.0","51.0","40.9","59.1","","","5000 to 19,999","Leeds City Council","False","06/10/2021 00:00:00","18/02/2021 10:10:54"
"LEES CLEANING CONTRACTORS LLP","43 Maxwell Street, South Shields, Tyne & Wear, NE33 4PU","OC350879","","1.6","0.0","","","0.0","0.0","24.0","76.0","24.0","76.0","24.0","76.0","24.4","75.6","http://leespremiercleaning.co.uk","JANE CARR (DIRECTOR)","250 to 499","LEES CLEANING CONTRACTORS LLP","False","06/10/2021 00:00:00","11/02/2021 11:47:32"
"Leicestershire Partnership Nhs Trust","Gwendolen Road, Leicester, Leicestershire, United Kingdom, LE5 4PW","","1,
86210","14.9","6.1","25.7","50.0","2.4","0.3","15.8","84.2","16.6","83.4","15.8","84.2","25.0","75.0","https://www.leicspart.nhs.uk/wp-content/uploads/2021/03/Gender-Pay-Gap-Report-2019-20-FOR-PUBLICATION.pdf","","5000 to 19,999","Leicestershire Partnership Nhs Trust","False","06/10/2021 00:00:00","02/03/2021 16:30:08"
"LENHAM STORAGE COMPANY LIMITED","MENZIES LLP, Ashcombe House, 5 The Crescent, Leatherhead, Surrey, KT22 8DY","00463800","49410","10.8","11.0","	-54.1","5.5","23.0","21.3","59.0","41.0","69.0","31.0","81.0","19.0","85.0","15.0","http://lenham.com/about-us/","Anthony Burgess (Finance Director)","250 to 499","LENHAM STORAGE COMPANY LIMITED","False","06/10/2021 00:00:00","23/02/2021 16:37:59"
"Liberty Leisure Limited","Town Hall, Foster Avenue, Beeston, Nottingham, NG9 1AB","","","9.8","0.0","","","0.0","0.0","41.9","58.1","21.9","78.1","25.0","75.0","40.6","59.4","https://www.lleisure.co.uk/gender-pay-gap-liberty-leisure-limited/","Chris Laxton-Kane (Managing Director)","Less than 250","Liberty Leisure Limited","False","06/10/2021 00:00:00","21/12/2020 17:09:52"
"LICENSED TRADE CHARITY","Heatherley, London Road, Ascot, SL5 8DR","RC000569","","11.0","14.6","","","0.0","2.0","24.7","75.3","32.1","67.9","34.6","65.4","38.8","61.2","","Jim Brewster (CEO)","250 to 499","LICENSED TRADE CHARITY","False","06/10/2021 00:00:00","03/03/2021 16:58:31"
"LILIAN FAITHFULL CARE","Ground Floor West, Festival House, Jessop Avenue, Cheltenham, Gloucestershire, England, GL50 3SH, GL50 3SH","06461263","87100,
87300","	-11.7","	-3.6","","","0.0","0.0","11.1","88.9","13.9","86.1","17.0","83.0","25.2","74.8","","Martin Hughes (CEO)","250 to 499","LILIAN FAITHFULL CARE","False","06/10/2021 00:00:00","18/02/2021 14:02:11"
"Lincolnshire Partnership NHS Foundation Trust","Long Leys Road, Lincoln, LN1 1FS","","1,
86210","22.1","20.4","19.8","19.5","2.9","0.2","13.0","87.0","18.0","82.0","20.0","80.0","28.0","72.0","https://www.lpft.nhs.uk/about-us/equality-and-diversity/equality-reports-and-data","","1000 to 4999","Lincolnshire Partnership NHS Foundation Trust","False","06/10/2021 00:00:00","02/03/2021 10:06:06"
"Lincolnshire Police","Fire and Police Headquarters, Deepdale Lane, Nettleham, LN2 2LT","","1,
84240","9.8","15","7.7","0","3","1.1","48.9","51.1","55.9","44.1","70.9","29.1","71.4","28.6","https://www.lincs.police.uk/about-us/equality-and-diversity/gender-pay-gap-reporting/","","1000 to 4999","Lincolnshire Police","False","06/10/2021 00:00:00","08/02/2021 13:28:19"
"Lingfield Education Trust","C/O Corporation Road Community Primary School, Corporation Road, Darlington, DL3 6AR","","1","19.9","17.5","","","0.0","0.0","16.2","83.8","11.8","88.2","8.8","91.2","10.0","90.0","","","250 to 499","Lingfield Education Trust","False","06/10/2021 00:00:00","23/02/2021 11:43:41"
"LINKLATERS BUSINESS SERVICES","One Silk Street, London, EC2Y 8HQ","00633907","82990","20.7","38.8","52.0","58.0","64.4","67.1","24.0","76.0","41.0","59.0","46.0","54.0","50.0","50.0","https://www.linklaters.com/en/about-us/diversity-and-inclusion/diversity-and-inclusion-reports","Angela Ogilvie (Global HR Director)","1000 to 4999","LINKLATERS BUSINESS SERVICES","False","06/10/2021 00:00:00","13/01/2021 17:11:08"
"LIQUID FRIDAY LIMITED","The Port House Marina Keep, Port Solent, Portsmouth, England, PO6 4TH","05887477","82990","0.0","0.0","	-35.4","	-130.8","99.3","99.0","87.5","12.5","81.9","18.1","71.8","28.2","54.8","45.2","","Joe Taffurelli (Head of Group Operations)","1000 to 4999","LIQUID FRIDAY LIMITED","False","06/10/2021 00:00:00","26/02/2021 14:55:15"
"LISTERS GROUP LIMITED","Othello House Stratford Business & Technology Park, Banbury Road, Stratford-Upon-Avon, Warwickshire, CV37 7GY","01400698","45111,
45112,
45200,
45320","17.5","14.6","52.1","57.3","76.2","67.9","75.3","24.7","79.7","20.3","85.5","14.5","85.5","14.5","https://listers.co.uk/gender-pay-gap-report","Geoff Lister (CEO)","1000 to 4999","LISTERS GROUP LIMITED","False","06/10/2021 00:00:00","10/03/2021 14:16:45"
"LIVE ACTIVE LEISURE LIMITED","Caledonia House, Hay Street, Perth, PH1 5HS","SC042641","93110","2.2","5.9","","","0.0","0.0","40.0","60.0","41.0","59.0","44.0","56.0","46.0","54.0","","Diane Gaffney (Head Of Corporate Support Services)","250 to 499","LIVE ACTIVE LEISURE LIMITED","False","06/10/2021 00:00:00","02/03/2021 14:06:54"
"Liverpool Victoria Friendly Society Limited","County Gates, Westbourne, Bournemouth, BH1 2NF","MUT00002","65110","28.6","27.8","48.2","35.9","94.5","96.8","30.4","69.6","36.2","63.8","48.5","51.5","63.9","36.1","","Mark Hartigan (Chief Executive Officer)","1000 to 4999","Liverpool Victoria Friendly Society Limited","False","06/10/2021 00:00:00","04/02/2021 14:39:22"
"LIVERPOOL VICTORIA GENERAL INSURANCE GROUP LIMITED","57 Ladymead, Guildford, Surrey, England, GU1 1DB","04332926","64205","22.1","14.7","49.9","29.1","87.7","89.2","43.0","57.0","39.0","61.0","49.0","51.0","64.0","36.0","https://www.lv.com/insurance/about-us/corporate-responsibility/people-culture/gender-pay-gap","Stephen Treloar (CEO)","1000 to 4999","LIVERPOOL VICTORIA GENERAL INSURANCE GROUP LIMITED","False","06/10/2021 00:00:00","03/03/2021 09:48:38"
"LIVEWIRE (WARRINGTON) CIC","Orford Jubilee Park, Jubilee Way, Warrington, WA2 8HE","07972958","86900,
91011,
93130","6.0","1.7","","","0.0","0.0","14.0","86.0","41.0","59.0","37.0","63.0","39.0","61.0","https://livewirewarrington.co.uk/about-us/about-livewire","Cheryl Siddall (People, Performance & Resources Director)","250 to 499","LIVEWIRE (WARRINGTON) CIC","False","06/10/2021 00:00:00","08/02/2021 16:13:45"
"LLOYDS BANK ASSET FINANCE LIMITED","25 Gresham Street, London, EC2V 7HN","00615235","64999","22.7","28.4","46.7","70.9","99.8","99.1","26.6","73.4","40.8","59.2","57.7","42.3","63.8","36.2","https://www.lloydsbankinggroup.com/assets/pdfs/who-we-are/responsible-business/downloads/lbg-gender-pay-gap-report-2019-20.pdf","Matt Sinnott (Group People & Productivity Director)","1000 to 4999","LLOYDS BANK ASSET FINANCE LIMITED","False","06/10/2021 00:00:00","11/12/2020 11:49:37"
"LLOYDS BANK COMMERCIAL FINANCE LIMITED","No 1 Brookhill Way, Banbury, Oxon, OX16 3EL","00733011","64910,
64999","23.7","10.4","35.6","30.7","99.1","100","27.5","72.5","45.1","54.9","57.7","42.3","82.4","17.6","https://www.lloydsbankinggroup.com/assets/pdfs/who-we-are/responsible-business/downloads/lbg-gender-pay-gap-report-2019-20.pdf","Matt Sinnott (Group People & Productivity Director)","Less than 250","LLOYDS BANK COMMERCIAL FINANCE LIMITED","False","06/10/2021 00:00:00","11/12/2020 11:50:21"
"LLOYDS BANK PLC","25 Gresham Street, London, EC2V 7HN","00002065","64191","33.5","40.2","66.3","62","92.8","95.2","32","68","33","67","48.5","51.5","65.5","34.5","https://www.lloydsbankinggroup.com/assets/pdfs/who-we-are/responsible-business/downloads/lbg-gender-pay-gap-report-2019-20.pdf","Matt Sinnott (Group People & Productivity Director)","20,000 or more","LLOYDS BANK PLC","False","06/10/2021 00:00:00","11/12/2020 11:51:01"
"LLOYDS BANKING GROUP PLC","The Mound, Edinburgh, EH1 1YZ","SC095000","64205","30.5","33.6","62.5","69.2","95.6","97.1","29.2","70.8","33.1","66.9","46.3","53.7","62.7","37.3","https://www.lloydsbankinggroup.com/assets/pdfs/who-we-are/responsible-business/downloads/lbg-gender-pay-gap-report-2019-20.pdf","Matt Sinnott (Group People & Productivity Director)","20,000 or more","LLOYDS BANKING GROUP PLC","False","06/10/2021 00:00:00","11/12/2020 11:50:09"
"LOCAL CARE DIRECT LIMITED","Unit 14 Longbow Close, Pennine Business Park, Bradley, HD2 1GQ","IP29766R","","	-11.10","	-21.60","7.10","18.20","85.80","83.10","52.00","48.00","49.00","51.00","19.00","81.00","27.00","73.00","https://www.localcaredirect.org","Diane Whale (Director of Finance)","250 to 499","LOCAL CARE DIRECT LIMITED","False","06/10/2021 00:00:00","16/06/2020 09:42:38"
"LOCAL PENSIONS PARTNERSHIP LTD","First Floor, 1 Finsbury Avenue, London, United Kingdom, EC2M 2PF","09830002","64205","29.5","19.1","51.1","7.9","15","6","55.4","44.6","32.9","67.1","52.4","47.6","70.7","29.3","https://www.localpensionspartnership.org.uk/Portals/0/Documents/Gender Pay Gap/Gender Pay Statement 2020 Final.pdf?ver=2021-02-25-085737-393","Adrian Taylor (Chief Financial Officer)","250 to 499","LOCAL PENSIONS PARTNERSHIP LTD","False","06/10/2021 00:00:00","25/02/2021 18:36:54"
"LOCAL SOLUTIONS","Mount Vernon Green, Hall Lane, Liverpool, L7 8TF","01792921","87900","18.0","3.0","65.0","83.0","9.0","8.0","14.0","86.0","11.0","89.0","11.0","89.0","28.0","72.0","https://www.localsolutions.org.uk/","Stephen Gough (Head of HR)","500 to 999","LOCAL SOLUTIONS","False","06/10/2021 00:00:00","17/02/2021 10:33:02"
"LODGE TYRE COMPANY LIMITED(THE)","Lodge House Unit E University Court, Staffordshire Technology Park, Stafford, England, ST18 0GE","00531793","45320","22.3","22.2","90.7","96.9","92.7","80.0","79.0","21.0","90.3","9.7","93.6","6.4","96.6","3.4","","Simon Christmas (Director)","250 to 499","LODGE TYRE COMPANY LIMITED(THE)","False","06/10/2021 00:00:00","02/03/2021 16:04:31"
"London Borough of Camden","Town Hall, Judd Street, London, WC1H 9JE","","1,
84110","	-4.6","	-0.6","10.9","0.1","28.3","32.4","47.0","53.0","41.0","59.0","41.0","59.0","45.0","55.0","","","1000 to 4999","London Borough of Camden","False","06/10/2021 00:00:00","28/01/2021 11:56:32"
"London Borough of Hillingdon","Civic Centre, High Street, Uxbridge, Middlesex, United Kingdom, UB8 1UW","","1,
84110","4.2","0.0","","","0.0","0.0","41.0","59.0","31.9","68.1","32.1","67.9","38.5","61.5","https://archive.hillingdon.gov.uk/article/33478/Gender-pay-gap","","1000 to 4999","London Borough of Hillingdon","False","06/10/2021 00:00:00","19/02/2021 11:13:10"
"London Borough Of Southwark","HR Data Team, 2nd Floor, 160 Tooley Street, London, SE1 2QH","","1,
84110","	-6.6","	-10.0","91.8","90.7","4.5","1.2","48.9","51.1","40.3","59.7","41.6","58.4","70.1","29.9","","","Not Provided","London Borough Of Southwark","False","06/10/2021 00:00:00","29/01/2021 09:34:31"
"London Metropolitan University","Tower Building, 166 - 220 Holloway Road, London, N7 8DB","","1,
85421","5.5","9.3","","","0.0","0.0","41.3","58.7","49.4","50.6","42.9","57.1","52.7","47.3","https://www.londonmet.ac.uk/about/equity/centre-for-equity-and-inclusion/","","1000 to 4999","London Metropolitan University","False","06/10/2021 00:00:00","05/03/2021 14:18:23"
"LONGACRES GARDEN CENTRE LIMITED","Longacres Nursery, London Road, Bagshot, Surrey, GU19 5JB","07689770","47760","	-1.0","0.0","","","0.0","0.0","41.0","59.0","29.0","71.0","36.0","64.0","30.0","70.0","https://www.longacres.co.uk/help/longacres-garden-centre-gender-pay-report/","Amarah Salman (Payroll Manager)","250 to 499","LONGACRES GARDEN CENTRE LIMITED","False","06/10/2021 00:00:00","19/10/2020 14:19:13"
"LOUVER-LITE LIMITED","Ashton Road, Hyde, Cheshire, SK14 4BG","01011431","32990","0.8","	-12.4","45.6","	-16.7","11.0","10.0","68.0","32.0","69.0","31.0","50.0","50.0","67.0","33.0","https://www.louvolite.com/wp-content/uploads/Gender-Pay-2021.pdf","Kelly-Lee Wilde (HR Manager)","250 to 499","LOUVER-LITE LIMITED","False","06/10/2021 00:00:00","01/03/2021 11:37:40"
"LOVEWELL BLAKE LLP","Windsor House, Bayshill Road, Cheltenham, England, GL50 3AT","OC354112","","15.7","15.0","	-185.0","62.3","5.3","6.9","38.0","62.0","28.0","72.0","38.0","62.0","55.0","45.0","https://lovewell-blake-assets.s3.eu-west-2.amazonaws.com/assets/downloads/gender-pay-report-2020.pdf","Colin Fish (Managing Partner)","250 to 499","LOVEWELL BLAKE LLP","False","06/10/2021 00:00:00","19/02/2021 07:48:20"
"LTE Group","34 Whitworth Street, Manchester, Greater Manchester, M1 3HB","","1,
85320","7.7","8.3","51.9","92.6","2.0","2.5","22.8","77.2","36.9","63.1","46.7","53.3","39.0","61.0","","","1000 to 4999","LTE Group","False","06/10/2021 00:00:00","29/01/2021 09:37:40"
"LUBRIZOL LIMITED","The Knowle, Nether Lane Hazelwood, Derby, Derbyshire, DE56 4AN","00775276","20590","24.2","23.4","38.3","21.6","100.0","100.0","60.3","39.7","63.5","36.5","76.2","23.8","86.5","13.5","https://www.lubrizol.com/Sustainability/Social/Diversity-and-Inclusion","Samantha Bradbury (Human Resources Manager)","500 to 999","LUBRIZOL LIMITED","False","06/10/2021 00:00:00","04/03/2021 14:15:58"
"MACFARLAN SMITH LIMITED","Wheatfield Road, Edinburgh, EH11 2QA","SC035640","21100","17.5","18.3","31.9","10.4","87.2","80.8","63.6","36.4","77.3","22.7","87.6","12.4","89.7","10.3","https://matthey.com/gender-pay-gap-report","Annette Kelleher (Chief HR Officer)","250 to 499","MACFARLAN SMITH LIMITED","False","06/10/2021 00:00:00","08/02/2021 11:51:37"
"MACINTYRE CARE","602 South Seventh Street, Central Milton Keynes, Buckinghamshire, MK9 2JA","00894054","87300","	-5.6","0.0","","","0.0","0.0","26.0","74.0","25.9","74.1","23.4","76.6","23.4","76.6","","Helen Bass (Workforce Director)","1000 to 4999","MACINTYRE CARE","False","06/10/2021 00:00:00","25/02/2021 10:35:49"
"MACINTYRE HUDSON LLP","Moorgate House, 201 Silbury Boulevard, Milton Keynes, Buckinghamshire, MK9 1LZ","OC312313","","17.1","15.6","35.8","18.9","36.0","29.7","45.4","54.6","41.0","59.0","49.3","50.7","61.8","38.2","https://www.macintyrehudson.co.uk/","Rakesh Shaunak (Managing Partner)","500 to 999","MACINTYRE HUDSON LLP","False","06/10/2021 00:00:00","11/02/2021 17:26:08"
"MAGENTA LIVING","Partnership Building, Hamilton Street, Birkenhead, Merseyside, CH41 5AA","04912562","68201","1.4","	-1.4","","","0.0","0.0","50.0","50.0","70.0","30.0","60.0","40.0","55.0","45.0","http://www.magentaliving.org.uk","Joanne Francom (Assistant Director, HR&OD)","500 to 999","MAGENTA LIVING","False","06/10/2021 00:00:00","24/02/2021 15:17:56"
"MAGNA HOUSING LIMITED","Oak House, Poundbury Road, Dorchester, DT1 1SW","RS007520","","14.3","15.3","","","0.0","0.0","24.0","76.0","34.0","66.0","73.0","27.0","60.0","40.0","https://www.magna.org.uk/about-us/policy/gender-pay-gap-data-for-magna-housing-limited","Suzanne Muncaster (Head of HR)","250 to 499","MAGNA HOUSING LIMITED","False","06/10/2021 00:00:00","09/03/2021 17:04:37"
"MAJESTIC WINE WAREHOUSES LIMITED","Majestic House The Belfry, Colonial Way, Watford, Hertfordshire, United Kingdom, WD24 4WH","01594599","46342","	-3.5","	-1.3","12.7","9.2","88","90","71.7","28.3","73","27","70","30","68.2","31.8","","Keith Blessley (Store Operations Director)","1000 to 4999","MAJESTIC WINE WAREHOUSES LIMITED","False","06/10/2021 00:00:00","12/11/2020 13:43:01"
"MAKRO SELF SERVICE WHOLESALERS LIMITED","Equity House, Irthlingborough Road, Wellingborough, Northamptonshire, NN8 1LT","00973269","46900","14.5","15.0","71.7","4.0","91.8","96.6","42.9","57.1","49.7","50.3","67.7","32.3","74.6","25.4","http://www.tescoplc.com/genderpay","Charles Wilson (Chief Executive-Booker)","500 to 999","MAKRO SELF SERVICE WHOLESALERS LIMITED","False","06/10/2021 00:00:00","24/02/2021 11:45:39"
"MALHOTRA CARE HOMES LIMITED","Malhotra House, 50 Grey Street, Newcastle Upon Tyne, England, NE1 6AE","06902590","87100,
87300","	-0.7","0.0","	-492.7","0.0","1.2","4.7","14.7","85.3","14.0","86.0","18.8","81.2","18.6","81.4","https://malhotragroup.co.uk","Andrew McColl (Finance Director)","500 to 999","MALHOTRA CARE HOMES LIMITED","False","06/10/2021 00:00:00","09/03/2021 12:37:19"
"MALHOTRA GROUP PLC","Malhotra House, 50 Grey Street, Newcastle Upon Tyne, England, NE1 6AE","07918146","70100","8.0","0.0","	-317.3","0.0","2.4","3.9","13.0","87.0","12.4","87.6","18.2","81.8","22.3","77.7","https://malhotragroup.co.uk/","Andrew McColl (Finance Director)","500 to 999","MALHOTRA GROUP PLC","False","06/10/2021 00:00:00","09/03/2021 12:42:03"
"MALTBY LEARNING TRUST","Braithwell Road, Maltby, Rotherham, South Yorkshire, S66 8AB","07033915","85100,
85200,
85310","26.3","37.0","","","0.0","0.0","10.5","89.5","14.5","85.5","36.0","64.0","40.1","59.9","https://www.maltbylearningtrust.com/_site/data/files/governance%20docs/A14191D065117FAF91741B92264970C4.pdf","","500 to 999","MALTBY LEARNING TRUST","False","06/10/2021 00:00:00","10/02/2021 13:01:55"
"MAMA BEAR'S DAY NURSERY LTD","1st Floor, 60-62 High Street, Hanham, Bristol, South Glos, BS15 3DR","04546256","88910","20.8","8.2","	-3.0","	-18.3","8.3","7.1","2.1","97.9","3.2","96.8","1.1","98.9","6.4","93.6","https://mamabear.co.uk/mama-bears-gender-pay-gap-report","Anthony Driffield (Director)","250 to 499","MAMA BEAR'S DAY NURSERY LTD","False","06/10/2021 00:00:00","14/01/2021 16:11:45"
"MAN GROUP SERVICES LIMITED","Riverbank House, 2 Swan Lane, London, EC4R 3AD","00459151","74990","18.2","26.1","58.9","45.5","88.9","86.5","54.6","45.4","67.4","32.6","85.9","14.1","78.9","21.1","https://www.man.com/diversity","Sarah Findlay (HRIS Analyst)","500 to 999","MAN GROUP SERVICES LIMITED","False","06/10/2021 00:00:00","11/03/2021 16:31:55"
"MANAGEMENT & TRAINING CORPORATION LIMITED","5th Floor, Capital Tower, 91 Waterloo Road, London, England, SE1 8RT","09284837","84230","15.2","0","64.1","82","25.6","26.9","44.7","55.3","43.7","56.3","49.5","50.5","52","48","","Ian Mulholland (Managing Director)","250 to 499","MANAGEMENT & TRAINING CORPORATION LIMITED","False","06/10/2021 00:00:00","11/03/2021 08:43:18"
"MANCHESTER OXFORD STREET HOTEL OPCO LIMITED","Broadwater Park, Denham, Uxbridge, England, UB9 5HR","11361054","55100","	-44.4","	-40.0","	-29.1","2.7","67.3","70.8","100.0","0.0","100.0","0.0","100.0","0.0","0.0","100.0","","Gail Bagley (Director HR Operations)","250 to 499","MANCHESTER OXFORD STREET HOTEL OPCO LIMITED","False","06/10/2021 00:00:00","19/02/2021 15:59:23"
"MANOR OF GROVES LIMITED","High Wych, Sawbridgeworth, Herts, CM21 0JU","03210984","55100","	-13.4","	-0.2","61.6","	-32.4","19.6","25.8","36.1","63.9","36.1","63.9","41.7","58.3","28.6","71.4","","James Barker (Hotel Manager)","Less than 250","MANOR OF GROVES LIMITED","False","06/10/2021 00:00:00","25/02/2021 08:39:26"
"Marine Management Organisation","Hampshire Court, Newcastle upon Tyne, Tyne & wear, NE4 7YH","","1,
84110","8.3","4.7","3.7","0.0","64.2","66.0","40.9","59.1","46.2","53.8","58.1","41.9","59.8","40.2","https://www.gov.uk/government/publications/marine-management-organisation-mmo-gender-pay-gap-report-2020","","250 to 499","Marine Management Organisation","False","06/10/2021 00:00:00","12/01/2021 10:37:09"
"MARIPOSA CARE GROUP LIMITED","Scholes Mill Old Coach Road, Tansley, Matlock, Derbyshire, United Kingdom, DE4 5FY","10104381","87100","6.5","0.0","","","0.0","1.2","5.8","94.2","8.6","91.4","14.4","85.6","21.6","78.4","https://www.mariposacare.com","Joanne Barry (Head of Finance)","500 to 999","MARIPOSA CARE GROUP LIMITED","False","06/10/2021 00:00:00","23/11/2020 12:57:06"
"MARITIME ACADEMY TRUST","C/O Millennium Primary School 50 John Harrison Way, Greenwich, London, United Kingdom, SE10 0BG","10264735","85200","19.0","44.0","","","0.0","0.0","5.0","95.0","12.0","88.0","25.0","75.0","17.0","83.0","https://www.maritimeacademytrust.org/Key-Documents/","","250 to 499","MARITIME ACADEMY TRUST","False","06/10/2021 00:00:00","24/02/2021 08:34:51"
"MARKS AND SPENCER FINANCIAL SERVICES PLC","Kings Meadow, Chester Business Park, Chester, United Kingdom, CH99 9FB","01772585","64999","13.7","2.8","33.3","19.0","89.5","90.7","33.0","67.0","28.0","72.0","29.0","71.0","39.0","61.0","https://www.hsbc.com/-/files/hsbc/investors/hsbc-results/2020/annual/pdfs/hsbc-holdings-plc/210223-uk-gender-pay-gap-report-2020.pdf?download=1","Elaine Arden (Group Chief Human Resources Officer, HSBC)","1000 to 4999","MARKS AND SPENCER FINANCIAL SERVICES PLC","False","06/10/2021 00:00:00","23/02/2021 12:55:47"
